{
  "schemaVersion": 1,
  "id": "advanced-1-kana",
  "title": {
    "zh-CN": "进阶版 1 · 片假名",
    "en": "Advanced 1 · Katakana",
    "ja": "発展 1・カタカナ"
  },
  "description": {
    "zh-CN": "与进阶英文版相同的角色和线索，使用片假名填答。更多冷门角色，线索更精简。",
    "en": "The same runners and clues as Advanced 1 in English, with katakana answers. More lesser-known runners and shorter clues.",
    "ja": "英字版「発展1」と同じウマ娘・ヒントをカタカナで解答。少し珍しいウマ娘も登場し、ヒントは短め。"
  },
  "difficulty": "advanced",
  "answerLanguage": "ja",
  "grid": {
    "rows": 19,
    "columns": 19,
    "layout": [
      "##############.##.#",
      "#########.####.##.#",
      "#########.#........",
      "#########.#.##.##.#",
      "#####.#.#.#.##.##.#",
      "#####.#.#.#.##.##.#",
      "##.##.#.#.#.......#",
      "##.##.......#######",
      "......#.###........",
      "##.####.....###.###",
      "##.#.##.#######.#.#",
      "##.#........#.#.#.#",
      "####.##.####.......",
      "####.########.#.#.#",
      "####.####......##.#",
      "####.########.###.#",
      "###.......###.###.#",
      "####.########.#####",
      "######........#####"
    ]
  },
  "entries": [
    {
      "id": "4-across",
      "number": 4,
      "direction": "across",
      "row": 2,
      "column": 11,
      "characterId": "nakayama-festa",
      "answer": "ナカヤマフェスタ",
      "clues": {
        "zh-CN": "原型马是2010年凯旋门赏亚军。",
        "en": "Her real-life counterpart finished second in the 2010 Prix de l'Arc de Triomphe.",
        "ja": "モデル馬は2010年の凱旋門賞で二着。"
      }
    },
    {
      "id": "8-across",
      "number": 8,
      "direction": "across",
      "row": 6,
      "column": 11,
      "characterId": "rice-shower",
      "answer": "ライスシャワー",
      "clues": {
        "zh-CN": "原型马在1993年终结春季天皇赏三连霸之梦。",
        "en": "Her counterpart ended a bid for three consecutive spring Tenno Sho wins in 1993.",
        "ja": "モデル馬は1993年、天皇賞（春）三連覇の夢を阻んだ。"
      }
    },
    {
      "id": "9-across",
      "number": 9,
      "direction": "across",
      "row": 7,
      "column": 5,
      "characterId": "seiun-sky",
      "answer": "セイウンスカイ",
      "clues": {
        "zh-CN": "午睡与钓鱼，也是她的日常功课。",
        "en": "Naps and fishing are part of her daily routine.",
        "ja": "昼寝と釣りも日々の楽しみ。"
      }
    },
    {
      "id": "10-across",
      "number": 10,
      "direction": "across",
      "row": 8,
      "column": 0,
      "characterId": "yaeno-muteki",
      "answer": "ヤエノムテキ",
      "clues": {
        "zh-CN": "用竞赛磨炼家传武艺，报答祖父母。",
        "en": "She hones her family's martial art through racing to repay her grandparents.",
        "ja": "レースで家伝の武術を磨き、祖父母に恩返し。"
      }
    },
    {
      "id": "11-across",
      "number": 11,
      "direction": "across",
      "row": 8,
      "column": 11,
      "characterId": "agnes-tachyon",
      "answer": "アグネスタキオン",
      "clues": {
        "zh-CN": "原型马以四战全胜拿下2001年皋月赏。",
        "en": "His fourth start brought a fourth win in the 2001 Satsuki Sho.",
        "ja": "モデル馬は2001年の皐月賞を勝ち、四戦四勝となった。"
      }
    },
    {
      "id": "13-across",
      "number": 13,
      "direction": "across",
      "row": 9,
      "column": 7,
      "characterId": "inari-one",
      "answer": "イナリワン",
      "clues": {
        "zh-CN": "139厘米的江户姑娘。",
        "en": "An Edo girl standing 139 cm tall.",
        "ja": "身長139cmの江戸っ子。"
      }
    },
    {
      "id": "16-across",
      "number": 16,
      "direction": "across",
      "row": 11,
      "column": 4,
      "characterId": "ikuno-dictus",
      "answer": "イクノディクタス",
      "clues": {
        "zh-CN": "彻底管理身体，只为把竞赛生涯延长。",
        "en": "She manages her condition meticulously to keep racing for as long as possible.",
        "ja": "徹底した体調管理で、できるだけ長く走る。"
      }
    },
    {
      "id": "18-across",
      "number": 18,
      "direction": "across",
      "row": 12,
      "column": 12,
      "characterId": "zenno-rob-roy",
      "answer": "ゼンノロブロイ",
      "clues": {
        "zh-CN": "图书委员，心里装着成为故事主角的梦。",
        "en": "A library committee member who dreams of being a story's heroine.",
        "ja": "物語の主人公を夢見る図書委員。"
      }
    },
    {
      "id": "19-across",
      "number": 19,
      "direction": "across",
      "row": 14,
      "column": 9,
      "characterId": "air-groove",
      "answer": "エアグルーヴ",
      "clues": {
        "zh-CN": "喜爱花卉的学生会副会长。",
        "en": "A flower-loving vice president of the student council.",
        "ja": "花を愛する生徒会副会長。"
      }
    },
    {
      "id": "20-across",
      "number": 20,
      "direction": "across",
      "row": 16,
      "column": 3,
      "characterId": "mejiro-palmer",
      "answer": "メジロパーマー",
      "clues": {
        "zh-CN": "在优秀亲族的阴影下，找到“逃”的答案。",
        "en": "In the shadow of talented relatives, she found her answer in running away.",
        "ja": "優秀な親族の陰で、見つけた答えは「逃げる」こと。"
      }
    },
    {
      "id": "21-across",
      "number": 21,
      "direction": "across",
      "row": 18,
      "column": 6,
      "characterId": "sakura-chiyono-o",
      "answer": "サクラチヨノオー",
      "clues": {
        "zh-CN": "把每日心得写成不太好懂的格言。",
        "en": "She turns her daily discoveries into rather puzzling maxims.",
        "ja": "日々の気づきを、ちょっと伝わりにくい格言に。"
      }
    },
    {
      "id": "1-down",
      "number": 1,
      "direction": "down",
      "row": 0,
      "column": 14,
      "characterId": "tsurumaru-tsuyoshi",
      "answer": "ツルマルツヨシ",
      "clues": {
        "zh-CN": "向往三冠，却常因全力以赴而累倒。",
        "en": "She dreams of the Triple Crown but often collapses after giving her all.",
        "ja": "三冠を夢見て全力投球、でも倒れてしまいがち。"
      }
    },
    {
      "id": "2-down",
      "number": 2,
      "direction": "down",
      "row": 0,
      "column": 17,
      "characterId": "grass-wonder",
      "answer": "グラスワンダー",
      "clues": {
        "zh-CN": "美国出生，却从小深受日本文化熏陶。",
        "en": "Born in America, but immersed in Japanese culture from childhood.",
        "ja": "アメリカ生まれ、日本文化に憧れて育った。"
      }
    },
    {
      "id": "3-down",
      "number": 3,
      "direction": "down",
      "row": 1,
      "column": 9,
      "characterId": "biko-pegasus",
      "answer": "ビコーペガサス",
      "clues": {
        "zh-CN": "走进玩具店，就会很久不肯出来。",
        "en": "Once she enters a toy shop, she does not come out for quite a while.",
        "ja": "おもちゃ屋に入ると、なかなか出てこない。"
      }
    },
    {
      "id": "4-down",
      "number": 4,
      "direction": "down",
      "row": 2,
      "column": 11,
      "characterId": "narita-brian",
      "answer": "ナリタブライアン",
      "clues": {
        "zh-CN": "琵琶晨光的妹妹，身兼学生会副会长。",
        "en": "Biwa Hayahide's younger sister, and a student council vice president.",
        "ja": "ビワハヤヒデの妹で、生徒会副会長も務める。"
      }
    },
    {
      "id": "5-down",
      "number": 5,
      "direction": "down",
      "row": 4,
      "column": 5,
      "characterId": "fuji-kiseki",
      "answer": "フジキセキ",
      "clues": {
        "zh-CN": "母亲是舞台演员的栗东宿舍长。",
        "en": "The Ritto dorm leader whose mother is a stage performer.",
        "ja": "母が舞台俳優の、栗東寮の寮長。"
      }
    },
    {
      "id": "6-down",
      "number": 6,
      "direction": "down",
      "row": 4,
      "column": 7,
      "characterId": "shinko-windy",
      "answer": "シンコウウインディ",
      "clues": {
        "zh-CN": "原型马赢得1997年二月锦标。",
        "en": "Her counterpart won the 1997 February Stakes.",
        "ja": "モデル馬は1997年のフェブラリーSを制した。"
      }
    },
    {
      "id": "7-down",
      "number": 7,
      "direction": "down",
      "row": 6,
      "column": 2,
      "characterId": "yukino-bijin",
      "answer": "ユキノビジン",
      "clues": {
        "zh-CN": "农家出身，想做闪闪发光的都市女孩。",
        "en": "A farm girl who wants to become a sparkling city girl.",
        "ja": "農家育ちで、きらめくシチーガールを夢見る。"
      }
    },
    {
      "id": "12-down",
      "number": 12,
      "direction": "down",
      "row": 8,
      "column": 15,
      "characterId": "tamamo-cross",
      "answer": "タマモクロス",
      "clues": {
        "zh-CN": "贫穷磨出的斗志，藏在一口关西腔里。",
        "en": "A fighting spirit forged by poverty, voiced in a Kansai dialect.",
        "ja": "貧しさが鍛えた闘志を、関西弁に乗せて。"
      }
    },
    {
      "id": "14-down",
      "number": 14,
      "direction": "down",
      "row": 10,
      "column": 4,
      "characterId": "ines-fujin",
      "answer": "アイネスフウジン",
      "clues": {
        "zh-CN": "为了补贴家用而打工，家中有一对双胞胎妹妹。",
        "en": "She works part-time to support her family and has twin younger sisters.",
        "ja": "家計を助けるためにアルバイト。双子の妹がいる。"
      }
    },
    {
      "id": "15-down",
      "number": 15,
      "direction": "down",
      "row": 10,
      "column": 17,
      "characterId": "mejiro-bright",
      "answer": "メジロブライト",
      "clues": {
        "zh-CN": "名门出身，却始终慢悠悠地按自己的步调前行。",
        "en": "Born into a prestigious family, she still moves at her own unhurried pace.",
        "ja": "名門育ちでも、のんびりマイペースを貫く。"
      }
    },
    {
      "id": "17-down",
      "number": 17,
      "direction": "down",
      "row": 11,
      "column": 13,
      "characterId": "bamboo-memory",
      "answer": "バンブーメモリー",
      "clues": {
        "zh-CN": "因电视剧里的竹刀形象而当上风纪委员长。",
        "en": "A TV drama character with a bamboo sword inspired her to lead the disciplinary committee.",
        "ja": "ドラマの竹刀姿に憧れ、風紀委員長に。"
      }
    }
  ]
}
